user,text,hashtags,likes,timestamp
@vale,Resumen rápido: sdn + ideas = magia ✨,sdn,22,2025-09-01 05:54:00
@ana,Mini hilo sobre sdn: config y buenas prácticas.,sdn,13,2025-09-01 16:27:00
@ana,Mejorando rendimiento con qos 💡,"qos, throughput, 5g, streaming",30,2025-09-02 21:06:00
@tomas,Weekly recap about qos.,"qos, streaming, wifi, edge",29,2025-09-04 18:31:00
@tomas,Resumen rápido: 5g + ideas = magia ✨,5g,17,2025-09-04 18:51:00
@sofia,Mini hilo sobre gaming: config y buenas prácticas.,"gaming, latency, throughput",14,2025-09-05 05:44:00
@sofia,Does wifi really boost performance? 🤔,"wifi, edge, throughput, qos",24,2025-09-05 10:01:00
@clara,gaming + tuning combo rocks!,gaming,34,2025-09-05 23:04:00
@clara,Probando tips de streaming con Campaña B 🚀,"streaming, gaming, wifi, 5g",10,2025-09-06 05:51:00
@clara,Mediciones y benchmarks para throughput 🔧,throughput,24,2025-09-06 08:54:00
